<?xml version="1.0" encoding="UTF-8"?>

<!ELEMENT Showpieces (Showpiece+)>

<!ELEMENT Showpiece (name, material, dateOfRelevance)>
<!ATTLIST Showpiece
    id CDATA #REQUIRED
>

<!ELEMENT name (#PCDATA)>
<!ELEMENT material (#PCDATA)>
<!ELEMENT dateOfRelevance (#PCDATA)>
